{
  "id": "northeast_faerun",
  "name": "Northeast Faerûn",
  "world": "totil",
  "continent": "fearun",
  "region": "northeast_faerun",
  "description": "Northeast Faerûn, also known as the Cold Lands, includes the rugged kingdoms of Damara and Vaasa, as well as the vast plains of Narfell. It is a region of ancient magic and stark beauty.",
  "focal_point": [
    13004,
    17707
  ],
  "zoom": 4
}